1;                             Tenho amor ao meu título;I love my title;Neg,Neu,Pos,Compound;0.0;0.323;0.677;0.6369
1;                             Cuidado que você vai ser chamado de Isentão se não votar no Bozzonaro, hein;Beware that you will be called Isentão if you do not vote for Bozzonaro, huh;Neg,Neu,Pos,Compound;0.0;1.0;0.0;0.0
1;                            Com certeza;Certainly;Neg,Neu,Pos,Compound;0.0;0.0;1.0;0.34
1;                            ;;Neg,Neu,Pos,Compound;0.0;0.0;0.0;0.0
1;                            Despreparado, incompetente, oportunista, medroso, mentiroso;Unprepared, incompetent, opportunistic, fearful, liar;Neg,Neu,Pos,Compound;0.915;0.085;0.0;-0.8658
0;                            e o que eu tenho a ver com isso? continuam sendo 2 lixos.... um lixo condenado e outro lixo burro e incompetente...;And what do I have to do with it? they are still 2 garbage .... a damn garbage and another garbage dumb and incompetent ...;Neg,Neu,Pos,Compound;0.324;0.676;0.0;-0.8442
0;                          Sei, conheço todos de longa data e sei que nenhum deles ganha dinheiro com essa bomba de twitter. Aquela máxima esquerdista, diga dos outros aquilo que você faz.;"I know, I&#39;ve known everyone for a long time and I know that none of them make money from this twitter bomb. That leftist maxim, tell others what you do.";Neg,Neu,Pos,Compound;0.11;0.89;0.0;-0.4939
1;                           Ahahahahah;Ahahahahah;Neg,Neu,Pos,Compound;0.0;1.0;0.0;0.0
1;                          E vem cá, qual o problema em votar no Xuxu? Os caras votam no Bolsonaro que está em um partido que apoia o PT em alguns estados, político de carreira, 30 anos e fez bosta alguma além de apoiar o próprio PT. Eles não tem moral alguma para falar algo.;"And come here, what&#39;s wrong with voting for Xuxu? The guys vote for the Bolsonaro who is in a party that supports the PT in some states, career politician, 30 years and did some bullshit besides supporting the PT itself. They have no morals to say anything.";Neg,Neu,Pos,Compound;0.159;0.699;0.142;-0.25
0;                            O negócio dele era chamar o Jean de bicha;His business was to call Jean de quee;Neg,Neu,Pos,Compound;0.0;1.0;0.0;0.0
1;                           Sao, eles amam vocês.;Sao, they love you.;Neg,Neu,Pos,Compound;0.0;0.417;0.583;0.6369
1;                           Hahahha;Hahaha;Neg,Neu,Pos,Compound;0.0;0.0;1.0;0.5574
1;                           Nossa, alguém pode me traduzir esse Tweet? Baixou a Dilma?;Wow, can someone translate this Tweet me? Did you lower Dilma?;Neg,Neu,Pos,Compound;0.143;0.586;0.271;0.4515
1;                          Eu sei, mas estou respondendo para a galerinha faça o que digo mas não faça o que eu faço.;"I know, but I&#39;m responding to the little gallery do what I say but do not do what I do.";Neg,Neu,Pos,Compound;0.0;1.0;0.0;0.0
1;                           Meu voto vai ser de centro. Pr'quele q estiver melhor colocado. Não posso admitir um segundo turno entre extremistas.;My vote will be centered. Which one is better placed. I can not admit a second round between extremists.;Neg,Neu,Pos,Compound;0.082;0.77;0.149;0.32
1;                            Ele é militar, por que aqui essa mamata é permitida.;"He&#39;s a military man, because this mamata is allowed here.";Neg,Neu,Pos,Compound;0.0;1.0;0.0;0.0
1;                            kkkkk;lol;Neg,Neu,Pos,Compound;0.0;0.0;1.0;0.4215
1;                          Você é o Target!;"You&#39;re Target!";Neg,Neu,Pos,Compound;0.0;1.0;0.0;0.0
1;  Estamos juntos #ChamaOMeirelles;We are together #ChamaOMeirelles;Neg,Neu,Pos,Compound;0.0;1.0;0.0;0.0
1;                            E quem tem? LULADRÃO? DILMANTA? Prefiro um radical do que um LADRÃO, mas cada um com suas prioridades...., ahh o MITO ainda é militar, cheque seus fatos antes de falar BOSTA;And who has it? LULADRÃO? DILMANTA? I prefer a radical than a THIEF, but each with its priorities ...., ahh MYTH is still military, check your facts before you talk BOSTA;Neg,Neu,Pos,Compound;0.103;0.897;0.0;-0.4778
0;                         Você vai votar no honestao,  que recebeu dinheiro da jbs;You will vote for the honesty, which received money from jbs;Neg,Neu,Pos,Compound;0.0;0.758;0.242;0.4939
1;                          Ahahahaha ele se descobriu isentao agora.;Ahahahaha he found out now.;Neg,Neu,Pos,Compound;0.0;1.0;0.0;0.0
1;                          É que sou Isentão Raiz;"It&#39;s just that I&#39;m Isentão Raiz";Neg,Neu,Pos,Compound;0.0;1.0;0.0;0.0
1;                          Felipe, é estranho você usar o mesmo termo dos bolsomions e votar no Meirelles.;"Felipe, it&#39;s strange that you use the same term from the bolsomions and vote for Meirelles.";Neg,Neu,Pos,Compound;0.107;0.893;0.0;-0.2023
1;                          Beleza;Beauty;Neg,Neu,Pos,Compound;0.0;0.0;1.0;0.5859
1;                          Mira, vc, o  e eu somos a razão de viver dos . É muito amor 💕;"Look, you and I are the reason we live. It&#39;s too much love";Neg,Neu,Pos,Compound;0.0;0.724;0.276;0.6369
1;"                          Rodrigues, é que o perfil que eu mencionei foi criado exclusivamente para ""zoar"" o pessoal desse post. Recentemente esse perfil foi divulgado pelo Bozzo Filho. E única coisa que essa página faz é dizer que essa galera trampa pro Geraldo Alckmin.";"Rodrigues, is that the profile I mentioned was created exclusively to &quot;screw up&quot; the staff of this post. Recently this profile was released by Bozzo Filho. And the only thing this page does is say that this trap galley for Geraldo Alckmin.";Neg,Neu,Pos,Compound;0.06;0.894;0.046;-0.1593
0;                          Eu não sou isento e essa horda de Burrominions jumentos não define o que penso ou falo... tenho tanto nojo do Lula quanto do Bolsonaro... eles são 2 lados da mesma moeda que se complementam... 2 lixos...;I am not exempt and this horde of Burrominions donkeys does not define what I think or say ... I have as much disgust from Lula as from Bolsonaro ... they are 2 sides of the same coin that complement each other ... 2 garbage ...;Neg,Neu,Pos,Compound;0.118;0.882;0.0;-0.6365
1;                         Kkkkkkkkkkkkk..... parabéns, votar em LADRÃO é o jeito.....;Kkkkkkkkkkkkk ..... Congratulations, voting for THIEF is the way .....;Neg,Neu,Pos,Compound;0.258;0.499;0.243;-0.0601
0;                           Ate agora não vi ou ouvi claras falas, são mesmos ovos, sera teremos Jurassic Park, meu, estou 65 anos, não consigo ver esses. Microbios fazerem algo, são todos blá blá blá blá blá blá;"Until now I have not seen or heard clear lines, they are the same eggs, we will have Jurassic Park, my, I am 65 years old, I can not see these. Microbios do something, they&#39;re all blah blah blah blah blah blah";Neg,Neu,Pos,Compound;0.195;0.744;0.06;-0.2023
1;                            A diferença entre Bolsonaro e Luladrão, é que um nunca foi indiciado ou condenado por ROUBAR A VERBA PÚBLICA, o outro.... o outro é o maior LADRÃO DA HISTÓRIA DA HUMANIDADE;The difference between Bolsonaro and Luladrão is that one has never been indicted or convicted for STEALING THE PUBLIC WORD, the other .... the other is the greatest THIEF OF THE HISTORY OF HUMANITY;Neg,Neu,Pos,Compound;0.196;0.708;0.096;-0.656
0;                          Não entendi o quis dizer;I did not understand what you wanted to say.;Neg,Neu,Pos,Compound;0.0;1.0;0.0;0.0
1;                           Só;Only;Neg,Neu,Pos,Compound;0.0;1.0;0.0;0.0
1; #ChamaOMeirelles;#ChamaOMeirelles;Neg,Neu,Pos,Compound;0.0;1.0;0.0;0.0
1;" Bora lá, 
#ChamaOMeirelles";Come on over there, #ChamaOMeirelles;Neg,Neu,Pos,Compound;0.0;1.0;0.0;0.0
0;"                        O sonho da  é ver essa galera declarando voto no  ! Afinal de contas estamos todos, dia e noite nos porões do PSDB, criando posts isentos, ""mas de apoio ao Geraldão"", capitaneados por  !";"The dream is to see this galera declaring no vote! After all we are all day and night in the basements of the PSDB, creating exempt posts, &quot;but of support to the Gerald&quot;, captained by!";Neg,Neu,Pos,Compound;0.054;0.73;0.216;0.6892
1; Bora, #ChamaOMeirelles;Bora, #ChamaOMeirelles;Neg,Neu,Pos,Compound;0.0;1.0;0.0;0.0
1;  Verdade. 👏👏👏;Truth. (I.e.;Neg,Neu,Pos,Compound;0.0;0.303;0.697;0.3182
1;                          kkkkkkk Isentões é meu fã;kkkkkkk Isentões is my fan;Neg,Neu,Pos,Compound;0.0;0.635;0.365;0.3182
1;"Bora mudar o Brasil?
#ChamaOMeirelles                💚💛🇧🇷💚💛🇧🇷💚💛 ";Bora to change Brazil? #ChamaOMeirelles;Neg,Neu,Pos,Compound;0.0;1.0;0.0;0.0
1;                       👍;(I.e.;Neg,Neu,Pos,Compound;0.0;1.0;0.0;0.0
0;   Amoêdo saiu com essa de “conservador nos costumes” p/reagir contra o bolsonaristas que saíram com o factóide que ele não se posicionou radicalmente contra aquele crucial problema da nação, peladões em museus. Faltou traquejo, mas justamente por uma qualidade dele: Outsider.;"Amoedo left with that of &quot;conservative in the mores&quot; to react against the bolsonaristas that left with the factoóide that he did not position radically against that crucial problem of the nation, peladões in museums. He lacked traquejo, but precisely because of his quality: Outsider.";Neg,Neu,Pos,Compound;0.04;0.96;0.0;-0.2144
1;  Concordo 110%.;I agree 110%.;Neg,Neu,Pos,Compound;0.0;0.286;0.714;0.3612
1;   Quando bolsonarista me tenta colocar em sinuca dizendo “Mas e se der Bolsonaro e Ciro no 2º turno em quem você votaria?”, sempre respondo “Céus, ter que escolher entre dois esquerdistas!”;"As a pockmarista, he tries to put me in the pool saying, &quot;But what if you give Bolsonaro and Ciro in the second round who you vote for?&quot; I always say, &quot;Heavens, to have to choose between two leftists!&quot;";Neg,Neu,Pos,Compound;0.0;1.0;0.0;0.0
0;"   Concordo plenamente. Votar em branco jamais, mesmo que for pra dar o aval democrático ao menos pior (digo isso até ver Bozzo e Ciro num segundo turno, aí ferrou kkk).
O mesmo projeto para o porte de armas, isso porque é um assunto tão delicado e está sendo tratado com brincadeira";I fully agree. Vote blank never, even if it is to give the democratic endorsement at least worse (I say this until I see Bozzo and Ciro in a second round, then screwed kkk). The same project for the carrying of weapons, this is because it is such a delicate matter and is being treated with banter;Neg,Neu,Pos,Compound;0.147;0.735;0.118;-0.5868
1; Verdade. O picolé de chuchu deveria desistir e apoiar o Álvaro Dias ou o Henrique Meirelles.;Truth. The popsicle of chuchu should give up and support Álvaro Dias or Henrique Meirelles.;Neg,Neu,Pos,Compound;0.0;0.722;0.278;0.6124
0;" Pra arrumar o Estado Brasileiro, passa primeiro por retirar os excessos de funcionalismo,desinchar o Estado.
Previdencia igual a todos
No governo PT, criaram-se 40 empresas 

Ao povo interessa, segurança, Saúde, Estradas, Ferrovias, Educação subsidiada a quem não tem condições.";To fix the Brazilian state, first of all, it removes the excesses of functionalism, disinfecting the state. Social security equal to all In the PT government, 40 companies were created. To the people, safety, Health, Roads, Railways, Subsidized education to those who do not have conditions.;Neg,Neu,Pos,Compound;0.0;0.857;0.143;0.7351
1;Henrique Meirelles decide enfatizar sua associação com Lula  ;Henrique Meirelles decides to emphasize his association with Lula;Neg,Neu,Pos,Compound;0.0;1.0;0.0;0.0
1;Henrique Meirelles decide enfatizar sua associação com Lula  VIA  ;Henrique Meirelles decides to emphasize his association with Lula VIA;Neg,Neu,Pos,Compound;0.0;1.0;0.0;0.0
0; REDUZIR sr. candidato... é fundamental REDUZIR a atual carga tributária;REDUCE MR. candidate ... it is fundamental to REDUCE the current tax burden;Neg,Neu,Pos,Compound;0.195;0.805;0.0;-0.4404
0;"   Sabemos  e conhecemos bem a ""classe""  e o pior, além da compostura , piadas velhas , não decorou nem uma nova .Só muda os nomes";"We know and know well the &quot;class&quot; and the worst, besides composure, old jokes, did not decorate a new one.";Neg,Neu,Pos,Compound;0.169;0.661;0.169;-0.25
1;"O ""É NOTÍCIA"" recebe na próxima segunda-feira (09), o pré-candidato a presidência da República,  Henrique Meirelles.
Vamos falar sobre política, economia, sua candidatura a presidência  e muito mais!
Logo após o Leitura Dinâmica, na  ! ";"The &quot;IS NEWS&quot; receives next Monday (09), the pre-candidate for the presidency of the Republic, Henrique Meirelles. Let&#39;s talk about politics, economics, your presidential candidacy and more! Soon after the Dynamic Reading, na!";Neg,Neu,Pos,Compound;0.0;0.91;0.09;0.4912
1;"O ""É NOTÍCIA"" recebe na próxima segunda-feira (09), o pré-candidato a presidência da República,  Henrique Meirelles.
Vamos falar sobre política, economia, sua candidatura a presidência  e muito mais!
Logo após o Leitura Dinâmica, na  ! ";"The &quot;IS NEWS&quot; receives next Monday (09), the pre-candidate for the presidency of the Republic, Henrique Meirelles. Let&#39;s talk about politics, economics, your presidential candidacy and more! Soon after the Dynamic Reading, na!";Neg,Neu,Pos,Compound;0.0;0.91;0.09;0.4912
1; Get a room;Get a room;Neg,Neu,Pos,Compound;0.0;1.0;0.0;0.0
1;Infelizmente, não deu desta vez. O esporte, assim como a vida, é cheio de surpresas. O importante, sempre, é lutar de cabeça erguida e honrar a camisa.;Unfortunately, it did not go this time. Sport, like life, is full of surprises. The important thing, always, is to fight with your head held high and honor your shirt.;Neg,Neu,Pos,Compound;0.13;0.625;0.245;0.5267
1; Estamos fora. Fora Temer. Fora golpistas.;"We&#39;re out. Out of fear. It was scammers.";Neg,Neu,Pos,Compound;0.314;0.686;0.0;-0.4939
1; #GoMei;#GoMei;Neg,Neu,Pos,Compound;0.0;1.0;0.0;0.0
1; O Brasil precisa mesmo é vencer fora dos campos e o senhor é o técnico mais preparado para escalar e comandar um bom time!;Brazil really needs to win outside the field and you are the most prepared coach to climb and lead a good team!;Neg,Neu,Pos,Compound;0.0;0.656;0.344;0.8573
1;  ;;Neg,Neu,Pos,Compound;0.0;0.0;0.0;0.0
0; As vezes se ganha as vezes se perde! E a vida segue...;Sometimes you win if you lose! And life goes on...;Neg,Neu,Pos,Compound;0.183;0.541;0.277;0.3382
1; Vida que segue... Seria bom vencer, mas não deu, continuamos a ser brasileiros e se cada um de nós fazer o melhor, teremos um país mais vencedor em todos os aspectos.;Life that follows ... It would be good to win, but it did not, we continue to be Brazilian and if each one of us does the best, we will have a more winning country in all aspects.;Neg,Neu,Pos,Compound;0.0;0.685;0.315;0.945
1;O hexa vem em 2022 com Meirelles presidente ;The hexa comes in 2022 with Meirelles president;Neg,Neu,Pos,Compound;0.0;1.0;0.0;0.0
1; A Bandeira está acima da camisa. Honrar a Bandeira.;Flag is above the shirt. Honor the Flag.;Neg,Neu,Pos,Compound;0.0;0.686;0.314;0.4939
0; Agora o foco tem que ser o seguinte: escolher o melhor presidente para o Brasil...;Now the focus has to be on choosing the best president for Brazil ...;Neg,Neu,Pos,Compound;0.0;0.756;0.244;0.6369
1; 🖕🖕🖕🖕🖕🖕🖕🖕;(I.e.;Neg,Neu,Pos,Compound;0.0;1.0;0.0;0.0
1; Sem surpresas;No surprises;Neg,Neu,Pos,Compound;0.537;0.0;0.463;-0.0772
1;  kkkkkkkkkkkkkkkkkkkkkkkkk;kkkkkkkkkkkkkkkkkkkkkkkk;Neg,Neu,Pos,Compound;0.0;1.0;0.0;0.0
0; Brasil perdeu a copa de 2.014 e a presidente foi reeleita. Melhor Temer se recandidatar...;"Brazil lost the cup of 2014 and the president was re-elected. You&#39;d better be afraid to reapply ...";Neg,Neu,Pos,Compound;0.108;0.755;0.137;0.1531
1; Surpresa é a politica! Só tomamos susto com as kgadas se vocês!!!;Surprise is the policy! We only take fright with the kg if you !!!;Neg,Neu,Pos,Compound;0.211;0.672;0.118;-0.3956
0; Calma meirelles. Ainda faltam 3 meses para as eleições. Muito cedo para o senhor desistir.;Calm meirelles. There are still 3 months left for the elections. Too early for you to give up.;Neg,Neu,Pos,Compound;0.0;0.874;0.126;0.3182
0;"Henrique Meirelles decide enfatizar sua associação com Lula | Renova Mídia 
INACREDITÁVEL, O QUE SE FAZ PRA TENTAR GANHAR UMA ELEIÇÃO!";Henrique Meirelles decides to emphasize his association with Lula | Renova Media UNBELIEVABLE, WHAT IT IS TO DO TO ATTEMPT TO WIN AN ELECTION!;Neg,Neu,Pos,Compound;0.0;0.741;0.259;0.8104
1; Apenas que não foi surpresa.;Only that was no surprise.;Neg,Neu,Pos,Compound;0.301;0.411;0.288;-0.0258
1;Nossa!!!   ;Wow!!!;Neg,Neu,Pos,Compound;0.0;0.0;1.0;0.6884
0;Na última quarta-feira (4), a página de Henrique Meirelles no Facebook patrocinava 14 postagens de vídeos quase idênticos com imagens de visitas do... ;"Last Wednesday (4), Henrique Meirelles&#39;s Facebook page sponsored 14 posts of almost identical videos with images of visits from the ...";Neg,Neu,Pos,Compound;0.0;1.0;0.0;0.0
1;"#Presidenciaveis2018

Henrique Meirelles (MDB)

“O novo contrato de concessão será mais atrativo e favorecerá comercialização da energia a preço de mercado.”

";"# Presidênciaveis2018 Henrique Meirelles (MDB) &quot;The new concession contract will be more attractive and will favor the commercialization of energy at market price.&quot;";Neg,Neu,Pos,Compound;0.0;0.704;0.296;0.7902
1;" Foco para o que importa:  País livre dos vermelhos. 

Avante reformas.
Avante temerx  
 
 
 ";Focus for what matters: Free reds country. Ongoing renovations. Avante temerx;Neg,Neu,Pos,Compound;0.0;0.672;0.328;0.5267
0; Cara, nada pode ser mias ridículo do que prepulsio de político torcendo em ano de Copa. Jura que você acha que isso dá votos?!;Dude, nothing can be more ridiculous than prepulsing politician cheering on Cup year. Swear you think this gives you votes ?!;Neg,Neu,Pos,Compound;0.167;0.704;0.129;0.1528
1;" Bolsonaro presidente!
✌🏼🇧🇷 ";President Bolsonaro! (I.e.;Neg,Neu,Pos,Compound;0.0;1.0;0.0;0.0
1;   ;;Neg,Neu,Pos,Compound;0.0;0.0;0.0;0.0
1;"  Outro Ditador? Jamais!
#DemocraciaSempre ";Another Dictator? Never! #DemocracySempre;Neg,Neu,Pos,Compound;0.0;1.0;0.0;0.0
1;   Outro ditador? #DitaduraNuncaMais #DemocraciaSempre ;Another dictator? #Decoration Never Again #Democracy;Neg,Neu,Pos,Compound;0.0;1.0;0.0;0.0
1;  Bora, #ChamaOMeirelles;Bora, #ChamaOMeirelles;Neg,Neu,Pos,Compound;0.0;1.0;0.0;0.0
0;Pré-candidato pelo MDB visita Chapecó e apresenta proposta de governo neste sábado (7), a partir das 10h. ;Pre-candidate for MDB visits Chapecó and presents government proposal on Saturday (7), from 10h.;Neg,Neu,Pos,Compound;0.0;1.0;0.0;0.0
0;    Mas ser conservador nos costumes é justamente não aceitar interferência do governo na vida privada. Governo liberal que quer decidir até se homem pode usar banheiro de mulher. Armas é outro ponto, nenhum governo deveria restringir a liberdade do cidadão de bem.;"But being conservative in customs is precisely not accepting government interference in private life. Liberal government wants to decide even if man can use woman&#39;s bathroom. Arms is another point, no government should restrict the freedom of the citizen of good.";Neg,Neu,Pos,Compound;0.139;0.719;0.142;0.2769
1;    Se uma determinada peça de teatro ou obra de arte não te agrada, não dê dinheiro a eles. O melhor censor é o público pagante. Com relação as armas, o Brasil precisa ter certeza de que não teremos alguém entrando nas escolas como nos EUA e depois conversamos a liberação do porte.;If a certain play or piece of art does not please you, do not give them money. The best censor is the paying public. With regard to guns, Brazil needs to be sure that we will not have anyone entering the schools like the US, and then we will talk about liberation of size.;Neg,Neu,Pos,Compound;0.077;0.714;0.209;0.8195
0;"    Você não percebe a incoerência disso? ""Conservador nos costumes"", como se o ""costume"" de uma nação pode-se ser decidida por uma canetada de governante. Se um estabelecimento permite  algo que você não concorda, não vá lá, o costume dita às regras do estado e não o contrário.";"Do not you see the inconsistency? &quot;Conservative in customs,&quot; as if the &quot;custom&quot; of a nation can be decided by a canetada de gobernante. If an establishment allows something you do not agree, do not go there, the custom dictates the state rules and not the other way around.";Neg,Neu,Pos,Compound;0.044;0.956;0.0;-0.2755
1; Parabéns Meirelles! Estaremos contigo! #ChamaOMeirelles;Congratulations Meirelles! We will be with you! #ChamaOMeirelles;Neg,Neu,Pos,Compound;0.0;0.61;0.39;0.6688
1;meu deus henrique meirelles tá no meu voo;My god, Henrique Meirelles is on my flight.;Neg,Neu,Pos,Compound;0.0;0.769;0.231;0.2732
1;  Já que é assim, #ChamaOMeirelles;Since this is so, #ChamaOMeirelles;Neg,Neu,Pos,Compound;0.0;1.0;0.0;0.0
1;E o Henrique Meirelles, não merece sua atenção, não? Pense bem, ele é o mais qualificado ;And Henrique Meirelles, does not deserve your attention, right? Think about it, he is the most qualified;Neg,Neu,Pos,Compound;0.0;1.0;0.0;0.0
1; A unica diferenca é que no esporte se a gente se dedicar e treinar muito, podemos vencer ja na vida, aqui no Brasil, dependemos da merda que os politicos fazem, ai ja viu neh!!!!!;The only difference is that in sports if we dedicate and train a lot, we can win already in life, here in Brazil, we depend on the shit that the politicians do, ai ja neh !!!!!;Neg,Neu,Pos,Compound;0.0;0.786;0.214;0.8741
0;    Bom vamos lá: Liberais tendem a ser sofisticados e sua defesa quase sempre culmina na parte econômica. Mas isso não resume o liberalismo. O que resume é o indivíduo à frente do coletivo.;"Well let&#39;s go there: Liberals tend to be sophisticated and their defense almost always culminates in the economic part. But this does not sum up liberalism. What it sums up is the individual at the head of the collective.";Neg,Neu,Pos,Compound;0.0;0.833;0.167;0.7351
1;  Esse é o meu receio! KD os milicos? O MDB já tem dono! Correndo, #ChamaOMeirelles;This is my fear! KD the milicos? The MDB already owns it! Running, #ChamaOMeirelles;Neg,Neu,Pos,Compound;0.225;0.775;0.0;-0.5837
0; Esse aí vai querer ser vice do ;This one will want to be vice;Neg,Neu,Pos,Compound;0.0;0.822;0.178;0.0772
0;    O Liberalismo DEMANDA um Estado de Direito (quem não demanda estado é o anarquismo). Então, dá sim para ser liberal e conservador. Basta excluir a procuração carola do que o sujeito faz no seu âmbito privado e não causa danos a terceiros.;Liberalism DEMANDS a Rule of Law (who does not demand state is anarchism). So, yes, to be liberal and conservative. It is enough to exclude the police power of attorney that the subject does in its private scope and does not cause damages to third parties.;Neg,Neu,Pos,Compound;0.037;0.779;0.184;0.7628
1;    Mas… O conservadorismo não se resume, por sua vez, a comportamento. Sua essência? Saber que as conquistas sociais foram duras de serem consideradas e é fácil e divertido destrui-las. Uma destas conquistas? O Estado de Direito.;But ... Conservatism does not come down to behavior. Your essence? Knowing that social achievements have been hard to be considered and it is easy and fun to destroy them. One of these achievements? The rule of law.;Neg,Neu,Pos,Compound;0.108;0.748;0.144;0.3939
0;    Tem sentido o “liberal na economia, conservador nos costumes”? Não. Isto é um churrasco vegetariano. O liberal não se intromete na vida pessoal dos indivíduos. Ponto. Se o sujeito quer transar com cactus injetando fluido de freio, ele que assuma os ônus de suas escolhas.;"Does the &quot;liberal in the economy, conservative in customs&quot; make sense? No. This is a vegetarian barbecue. The liberal does not meddle in the personal life of individuals. Score. If the subject wants to fuck with cactus by injecting brake fluid, he will assume the onus of his choices.";Neg,Neu,Pos,Compound;0.11;0.89;0.0;-0.6908
1;   E mais de 40% apoia Bolsonaro!;And more than 40% support Bolsonaro!;Neg,Neu,Pos,Compound;0.0;0.606;0.394;0.5033
1; Vão no #ChamaOMeirelles;Go to #ChamaOMeirelles;Neg,Neu,Pos,Compound;0.0;1.0;0.0;0.0
1; Vão no #ChamaOMeirelles;Go to #ChamaOMeirelles;Neg,Neu,Pos,Compound;0.0;1.0;0.0;0.0
0;                             Assim... Seria estranho roubar verba pública quem nunca foi NADA na administração pública... Bem como seria estranho receber proposta de propina quem não tem poder pra aprovar nada, não tem poder pra convencer ninguém, não  tem trânsito nenhum em NADA na esfera pública.;So ... It would be strange to steal public money who has never been NOTHING in the public administration ... As well as it would be strange to receive proposal of gratuity who does not have power to approve anything, does not have the power to convince nobody, has no traffic in NOTHING in the sphere public.;Neg,Neu,Pos,Compound;0.14;0.796;0.064;-0.5994
