0;   Charge bem captada.;Charge well captured.;Neg,Neu,Pos,Compound;0.0;0.488;0.512;0.2732
1;  Admire aquele que faz fortuna dando palestras.;Admire the one who makes a fortune by giving lectures.;Neg,Neu,Pos,Compound;0.0;0.56;0.44;0.6705
0;"Campanha liberal-petista?
“Henrique Meirelles, o candidato do MDB ao Planalto, pretende ‘engrossar’ o discurso e usar mais Lula na campanha presidencial, registra o Estadão.

“A mudança de tom... ";"Liberal-Petista campaign? &quot;Henrique Meirelles, the MDB candidate for the Planalto, intends to &#39;thicken&#39; the speech and use more Lula in the presidential campaign, records the Estadão. &quot;The change of tone ...";Neg,Neu,Pos,Compound;0.0;1.0;0.0;0.0
0;A decadência de Henrique Meirelles e viver a sombra de Lula e fantoche da esquerda:  via ;The decadence of Henrique Meirelles and live the shadow of Lula and puppet of the left: via;Neg,Neu,Pos,Compound;0.0;1.0;0.0;0.0
1;Adicionei um vídeo a uma playlist   decadência de Henrique Meirelles e viver a sombra de Lula e;I added a video to a decadence playlist of Henrique Meirelles and live the shadow of Lula and;Neg,Neu,Pos,Compound;0.0;1.0;0.0;0.0
0;  Tem que trabalhar irmão e ganhar o seu. Não dá pra admirar um cara que é deputado há 26 anos e coloca toda a família na política só mamando nas tetas do Estado.;Have to work brother and earn yours. You can not admire a guy who has been a deputy for 26 years and puts the whole family in politics only sucking on the tits of the state.;Neg,Neu,Pos,Compound;0.122;0.878;0.0;-0.5352
1;  Não és ingênuo assim.;"You&#39;re not naive like that.";Neg,Neu,Pos,Compound;0.305;0.433;0.262;-0.0762
0;  Brasileiro tem isso de achar que qualquer um que fica rico é roubando.;Brazilian has to think that anyone who gets rich is stealing.;Neg,Neu,Pos,Compound;0.227;0.552;0.221;-0.0258
0; Ainda torço pro  ser vice do ;I still hope to be vice;Neg,Neu,Pos,Compound;0.0;0.58;0.42;0.4404
1; Henrique Meirelles  lucrou mais de R$ 217 milhões com consultoria para grandes empresas só em 2016. Essa tal consultoria é a maior máquina de “dúvidas” sobre gastos verdadeiros em serviços “justificados” da política brasileira.;"Henrique Meirelles earned more than R $ 217 million with consultancy for large companies only in 2016. This consultancy is the largest machine of &quot;doubts&quot; about true expenditures on &quot;justified&quot; services of Brazilian policy.";Neg,Neu,Pos,Compound;0.0;0.917;0.083;0.4215
1; Henrique Meirelles  lucrou mais de R$ 217 milhões com consultoria para grandes empresas só em 2016. Essa tal consultoria é a maior máquina de “dúvidas” sobre gastos verdadeiros em serviços “justificados” da política brasileira.;"Henrique Meirelles earned more than R $ 217 million with consultancy for large companies only in 2016. This consultancy is the largest machine of &quot;doubts&quot; about true expenditures on &quot;justified&quot; services of Brazilian policy.";Neg,Neu,Pos,Compound;0.0;0.917;0.083;0.4215
1; ;;Neg,Neu,Pos,Compound;0.0;0.0;0.0;0.0
1;Encontro MDB Campinas! #chamaomeirelles ;About Me #chamaomeirelles;Neg,Neu,Pos,Compound;0.0;1.0;0.0;0.0
0; Informações incorretas. Henrique Meirelles nunca foi ministro da Fazenda de Lula;Incorrect information. Henrique Meirelles was never Minister of Finance of Lula;Neg,Neu,Pos,Compound;0.0;1.0;0.0;0.0
1;           Faço o mesmo. Mas não vejo nada de Bolsonaro. Ele só ri. Diz que tudo é fake news.  Joga na defesa achando que assim ganha o jogo.;"I do the same. But I do not see anything about Bolsonaro. He just laughed. Says it&#39;s all fake news. He plays in the defense thinking that this way wins the game.";Neg,Neu,Pos,Compound;0.081;0.653;0.266;0.7269
1;Paulo Gala e André Lara Resende estão auxiliando Henrique Meirelles no plano de governo.;Paulo Gala and André Lara Resende are assisting Henrique Meirelles in the government plan.;Neg,Neu,Pos,Compound;0.0;1.0;0.0;0.0
1;Estagnado nas pesquisas de intenção de voto, Henrique Meirelles fará uma aposta de risco para obter apoio e conseguir ser oficializado como candidato do... ;Stagnant in the polls, Henrique Meirelles will make a risk bet to get support and get certified as a candidate of the ...;Neg,Neu,Pos,Compound;0.088;0.798;0.113;0.1531
1; Meirelles é o único candidato sério dessas eleições! É a inacreditável o nível dos demais! Todos despreparados e que só sabem se atacar e propor projetos populistas e inviáveis! Por isso #ChamaOMeirelles;"Meirelles is the only serious candidate in these elections! It&#39;s the unbelievable level of others! All unprepared and only know if to attack and propose populist and unviable projects! Therefore #ChamaOMeirelles";Neg,Neu,Pos,Compound;0.15;0.798;0.051;-0.5386
0;   Eu acredito que numa campanha nacional, com tempo de TV e mais aberta nas redes sociais, nós tenhamos alguma chance sim. Não existe candidato com o currículo, a experiência e as propostas do Meirelles. Ele é conhecido da população, só temos que explorar isso dele. Eu vou com ele!;"I believe that in a national campaign, with TV time and more open in social networks, we have some chance yes. There is no candidate with Meirelles&#39; curriculum, experience and proposals. He is known to the population, we just have to explore that from him. I&#39;ll go with him!";Neg,Neu,Pos,Compound;0.043;0.86;0.098;0.4199
1;Pré-candidato à Presidência, Henrique Meirelles muda de tática e ‘cola’ em Lula:  ;"Pre-candidate for the Presidency, Henrique Meirelles changes tactics and &#39;cola&#39; in Lula:";Neg,Neu,Pos,Compound;0.0;1.0;0.0;0.0
0; vc tinha chance de obter meu voto. Pqna confesso, mas tinha! Agora farei campanha contra vc, amiguinho do PRESIDIÁRIO  ;"You had a chance to get my vote. I confess, but I did! Now I&#39;ll campaign against you, little buddy of the PRESIDIATE";Neg,Neu,Pos,Compound;0.0;0.914;0.086;0.2003
1;Encontro MDB Campinas! #chamaomeirelles;About Me #chamaomeirelles;Neg,Neu,Pos,Compound;0.0;1.0;0.0;0.0
1;   Também iria, mas temos que ser realistas.;It would, too, but we have to be realistic.;Neg,Neu,Pos,Compound;0.0;1.0;0.0;0.0
0;"   Mas infelizmente não vai emplacar.
O MDB vai ter que compor com alguém do centro político. Pra mim será um excelente vice.";But unfortunately it will not come. The MDB will have to compose with someone from the political center. For me it will be a great vice.;Neg,Neu,Pos,Compound;0.081;0.78;0.139;0.4019
0;" A propriedade das empresas é irrelevante, desde que o estado se empenhe em regular o mercado para coibir práticas nocivas que inibem sua prosperidade e bem estar; uma nação sem mercado interno forte é como um corpo sem alma, errante e à mercê das turbulências externas.";"Corporate ownership is irrelevant as long as the state strives to regulate the market to curb harmful practices that inhibit its prosperity and well-being; a nation without a strong internal market is like a body without a soul, wandering and at the mercy of external turmoil.";Neg,Neu,Pos,Compound;0.157;0.743;0.1;-0.4218
0;Meu deus achei que era só lenda mas realmente tem gente que faz campanha pro Henrique .;My god, I thought it was just legend but there are really people who campaign for Henry.;Neg,Neu,Pos,Compound;0.0;0.906;0.094;0.1406
0;  E vai continuar fechando se não pararmos a sangria. Se não acabarmos de vez com estes políticos que vivem de rodízio e comendo tudo.;And it will keep closing if we do not stop the bleeding. If we do not end up with these politicians who live around and eat everything.;Neg,Neu,Pos,Compound;0.0;0.932;0.068;0.2235
1;Ex-ministro Henrique Meirelles muda de tática e cola em Lula| Mídia Recôncavo ;"Former minister Henrique Meirelles changes tactics and &#39;cola&#39; in Lula | Recôncavo Media";Neg,Neu,Pos,Compound;0.0;1.0;0.0;0.0
0;" Aprendizados do governo Dilma: subsidiar indústrias não é fomento e sim gasto com agravante de reduzir receita; não prejudicar ciclo econômico virtuoso consolidado por pleitos de setores obsoletos da economia; entender que dinheiro do contribuinte não é p/ remunerar a máq pública";"Government learning Dilma: subsidizing industries is not foment but rather aggravated spending to reduce revenue; not to harm the virtuous economic cycle consolidated by lawsuits of obsolete sectors of the economy; understand that the taxpayer&#39;s money is not to remunerate the public maq";Neg,Neu,Pos,Compound;0.156;0.692;0.152;0.2083
0;  Fecharam muitas, é verdade, mas todas sofreram com a maior recessão da nossa história, dos anos 2014 e 2015 até hoje sofremos sequelas, sejamos justos!;"They closed many, it&#39;s true, but they all suffered with the greatest recession in our history, from the years 2014 and 2015 until today we suffer sequels, let&#39;s be fair!";Neg,Neu,Pos,Compound;0.273;0.503;0.223;-0.5255
1;Ex-ministro Henrique Meirelles muda de tática e cola em Lula  ;"Former minister Henrique Meirelles changes tactics and &#39;cola&#39; in Lula";Neg,Neu,Pos,Compound;0.0;1.0;0.0;0.0
1;Ex-ministro Henrique Meirelles muda de tática e cola em Lula  ;"Former minister Henrique Meirelles changes tactics and &#39;cola&#39; in Lula";Neg,Neu,Pos,Compound;0.0;1.0;0.0;0.0
1;  🤗;(I.e.;Neg,Neu,Pos,Compound;0.0;1.0;0.0;0.0
1;  É um direito seu, afinal vivemos numa democracia, só isso já é muito bom!;"It&#39;s your right, after all we live in a democracy, that&#39;s good enough!";Neg,Neu,Pos,Compound;0.0;0.775;0.225;0.4926
1;  Tudo bem, cada um é cada um.;All right, each one is each.;Neg,Neu,Pos,Compound;0.0;1.0;0.0;0.0
0;  Tirou do buraco????Sabes quantas empresas estão fechando por mês neste país?;Do you know how many companies are closing a month in this country?;Neg,Neu,Pos,Compound;0.0;1.0;0.0;0.0
0;Depois de afundar a economia junto com Temer, Henrique Meirelles agora quer defender legado dos governos Lula. ;After sinking the economy along with Temer, Henrique Meirelles now wants to defend the legacy of the Lula governments.;Neg,Neu,Pos,Compound;0.0;1.0;0.0;0.0
0;  Desculpa-me mas, nem pensar.;Excuse me, but not even think.;Neg,Neu,Pos,Compound;0.0;0.813;0.187;0.0387
1;  Mas existe um candidato que tirou o Brasil do buraco recentemente, chama-se ;But there is a candidate who took Brazil from the hole recently, it is called;Neg,Neu,Pos,Compound;0.0;1.0;0.0;0.0
1;  Foi bom trocar ideias com você, então tá! Mas vai pensando... O  é uma ótima opção!;"It was good to exchange ideas with you, okay! But you&#39;re thinking ... It&#39;s a great choice!";Neg,Neu,Pos,Compound;0.0;0.578;0.422;0.8585
1;  A tá!!!;A tá !!!;Neg,Neu,Pos,Compound;0.0;1.0;0.0;0.0
0;"  Agradeço! MDB, PSDB, PT, DEM, PDT, PP, PSB,PV partidos comunistas, esquerdistas, entre outros que tem políticos de carteirinha NEM PENSAR!!!! Quero mudanças! Chega de ver as mesmas caras. O Brasil com esta ""gente"" só afundou.";"Appreciate! MDB, PSDB, PT, DEM, PDT, PP, PSB, PV communist parties, leftists, among others that have politicians of cardboard NOR THINK !!!! I want changes! Enough of seeing the same faces. Brazil with this &quot;people&quot; just sank.";Neg,Neu,Pos,Compound;0.0;0.807;0.193;0.7825
1;  Já pesquisei toda a vida do  Esse site não me diz absolutamente nada e tão pouco é confiável, vai no Google. #ChamaOMeirelles;"I&#39;ve researched the whole life of this site. It tells me nothing at all and so little is reliable, it goes on Google. #ChamaOMeirelles";Neg,Neu,Pos,Compound;0.0;1.0;0.0;0.0
1;  Leia até o fim.;Read through.;Neg,Neu,Pos,Compound;0.0;1.0;0.0;0.0
1;  Mentir não vale, bora combater o bom combate, mas dentro da verdade? Isso chama-se ética! E tenho certeza que você preza a ética, assim como o ;"Lying is not worth fighting the good fight, but within the truth? This is called ethics! And I&#39;m sure you value ethics, just as the";Neg,Neu,Pos,Compound;0.152;0.484;0.364;0.8158
0;  Deste susto você sobrevive, o   está bancando a candidatura dele com recursos próprios! Bora, #ChamaOMeirelles é o melhor para os brasileiros!;From this scare you survive, you are banking his candidacy with his own resources! Bora, #ChamaOMeirelles is the best for Brazilians!;Neg,Neu,Pos,Compound;0.119;0.704;0.177;0.3786
0; Creio que para o que o país precisa o Meirelles é a pessoa ideal. Precisamos recuperar a economia para voltarmos a crescer e gerar mais empregos...;I think Meirelles is the ideal person for what the country needs. We need to recover the economy so we can grow back and generate more jobs ...;Neg,Neu,Pos,Compound;0.0;0.884;0.116;0.5267
0;  Se é candidato do MDB(PMDB), partido mercenário, oportunista, corrupto. Partido que leva a maior bolada do FUNDO PARTIDÁRIO , o maior roubo legalizado do Brasil, é pq Meirelles é ...................;If he is MDB candidate (PMDB), mercenary, opportunist, corrupt party. Party that takes the biggest heap of the PARTY FUND, the biggest legalized robbery in Brazil, is because Meirelles is ...................;Neg,Neu,Pos,Compound;0.0;0.729;0.271;0.8415
1;  Meirelles foi coordenador de todas as obras, superfaturadas e mal acabadas, municipais, estaduais e federais do governo Dilma.;Meirelles was the coordinator of all the overpriced and ill-finished municipal, state and federal works of the Dilma government.;Neg,Neu,Pos,Compound;0.0;1.0;0.0;0.0
0; Eu não estou, pois jamais será Presidente do Brasil. É melhor Já Ir se acostumando, o  vem aí! Bora lá, #ChamaOMeirelles;"I am not, because I will never be President of Brazil. It&#39;s better Already Get used to it, come on! Come on over there, #ChamaOMeirelles";Neg,Neu,Pos,Compound;0.0;0.873;0.127;0.4926
1;" Bora, a hora CHEGOU!
#ChamaOMeirelles";Bora, the time has arrived! #ChamaOMeirelles;Neg,Neu,Pos,Compound;0.0;1.0;0.0;0.0
1; Os resultados de Meirelles são ótimos... aliás, qualquer coisa que ele diga, técnicos vão achar legal. #MeirellesPresidente!;The results of Meirelles are great ... in fact, whatever he says, technicians will find it legal. #MeirellesPresident!;Neg,Neu,Pos,Compound;0.0;0.731;0.269;0.7088
1; Ele nunca roubou, e se for olhar pelo partido não salva um! Um bom Presidente e ético pode sim limpar o seu partido. A sua tese está ultrapassada. O  é o melhor candidato para os brasileiros, é o único com competência comprovada, acorda e #ChamaOMeirelles logo!;He never stole it, and if he looks for the party he does not save one! A good and ethical president can cleanse your party. Your thesis is outdated. O is the best candidate for Brazilians, he is the only one with proven competence, wake up and #ChamaOMeirelles logo!;Neg,Neu,Pos,Compound;0.085;0.689;0.227;0.8573
1;  O homem é o CR7 da Economia!;Man is the CR7 of Economy!;Neg,Neu,Pos,Compound;0.0;1.0;0.0;0.0
1;Ex-ministro Henrique Meirelles muda de tática e cola em Lula  ;"Former minister Henrique Meirelles changes tactics and &#39;cola&#39; in Lula";Neg,Neu,Pos,Compound;0.0;1.0;0.0;0.0
0; Dinheiro e idade pra você não faltam, vá descansar e aproveitar a vida. Queremos mudanças rápidas e esse não é seu forte. ;Money and age for you do not lack, go rest and enjoy life. We want quick changes and that is not your forte.;Neg,Neu,Pos,Compound;0.0;0.756;0.244;0.6664
1;Ex-ministro Henrique Meirelles muda de tática e cola em Lula - ;"Former minister Henrique Meirelles changes tactics and &#39;cola&#39; in Lula -";Neg,Neu,Pos,Compound;0.0;1.0;0.0;0.0
0;" ""O governo federal, este de Michel Temer, gastava em maio mais do que o de Dilma Rousseff [...]. Gasta mais tanto em termos reais e absolutos, em dinheiro, como em proporção do PIB."" .";"&quot;The federal government, this one of Michel Temer, spent in May more than that of Dilma Rousseff [...] Spends more in real and absolute terms, in money, as in proportion to GDP.&quot; .";Neg,Neu,Pos,Compound;0.0;1.0;0.0;0.0
1;Henrique Meirelles muda de tática e 'cola' no ex-presidente Lula  #Politica #Brasil #Economia ;"Henrique Meirelles changes tactics and &#39;cola&#39; in former president Lula #Politics #Brazil #Economy";Neg,Neu,Pos,Compound;0.0;1.0;0.0;0.0
0;Bolsonaro manda recado para Alckmin e Henrique Meirelles ;Bolsonaro sends a message to Alckmin and Henrique Meirelles;Neg,Neu,Pos,Compound;0.0;1.0;0.0;0.0
0;   O que que vocês andam fumando? 😂😂😂;What are you guys smoking? (I.e.;Neg,Neu,Pos,Compound;0.0;1.0;0.0;0.0
0;           Corajoso... kkk;Brave kkk;Neg,Neu,Pos,Compound;0.0;0.227;0.773;0.5267
0;" Vc é o temer acabaram com o sonho de uma nação.

É muita ousadia vir neste canal e pedir votos.";"You&#39;re the dread ended the dream of a nation. It is very bold to come on this channel and ask for votes.";Neg,Neu,Pos,Compound;0.116;0.695;0.189;0.2247
0;  Eles querem eleger o Henrique Meirelles pra aumentar os impostos e atolar a mão inteira no cu do povo.;They want to elect Henrique Meirelles to raise taxes and bury the whole hand in the ass of the people.;Neg,Neu,Pos,Compound;0.14;0.68;0.18;0.0
1;O jornalista Luciano Suassuna, secretário de imprensa da Presidência da República, está deixando o posto. A partir de segunda-feira (02.jul.2018), se integra ao marketing da campanha de Henrique Meirelles. ;The journalist Luciano Suassuna, press secretary of the Presidency of the Republic, is leaving the post. From Monday (02.Jul.2018), is integrated to the marketing of the campaign of Henrique Meirelles.;Neg,Neu,Pos,Compound;0.0;1.0;0.0;0.0
0;"😡😡 CADÊ OS EMPREGOS PROMETIDOS, GOLPISTAS? 😡😡

Em março,  Henrique Meirelles disse que ""o crescimento está espalhado pela economia"".

Já estamos quase em julho e... cadê os empregos? Cadê o crescimento?

Com golpistas, é mentira atrás de mentira!

";"😡😡 CADÊ THE JOBS PROMISED, GOLFERS? 😡😡 In March, Henrique Meirelles said that &quot;growth is spread throughout the economy&quot;. We are almost in July and ... where are the jobs? Where is growth? With scam artists, it&#39;s a lie behind a lie!";Neg,Neu,Pos,Compound;0.078;0.781;0.141;0.4525
0;"Talvez  não decole na campanha como merecia. Já que tem nome, tem projeto bem definido de Brasil, tem propostas, gabarito, competência e experiência para a tarefa.

Em um país mais sério, ele já estaria eleito. No que depender do meu voto, com certeza já está! ♥️🇧🇷 ";Maybe he did not take off in the campaign as he deserved. Since it has a name, it has a well-defined project from Brazil, it has proposals, feedback, competence and experience for the task. In a more serious country, he would already be elected. As it depends on my vote, surely it is already! (I.e.;Neg,Neu,Pos,Compound;0.029;0.913;0.058;0.3816
1;O  manteve em sua vida pública uma reputação limpa tal qual tinha em sua carreira no mercado. Em uma eleição marcada pela Lava Jato,tendo honestidade como tema principal, é vital quem quer que suba a rampa do  dia 01 de Janeiro de 2019 tenha um histórico limpo. ;He kept in his public life a clean reputation as he had in his career in the market. In an election marked by Lava Jato, having honesty as the main theme, it is vital whoever climbs the ramp on January 1, 2019 has a clean record.;Neg,Neu,Pos,Compound;0.0;0.787;0.213;0.8689
1;Mais do que isso, o  pretende colocar em prática o imposto sobre grandes fortunas através da taxação dos fundos exclusivos, bem como promover uma reforma tributária, que equalize a balança, pois hoje proporcionalmente, quem paga mais imposto é justamente os mais pobres. ;More than that, it intends to implement the tax on large fortunes by taxing the exclusive funds, as well as promoting a tax reform, which equalizes the balance, because today proportionally, who pays more tax is precisely the poorest.;Neg,Neu,Pos,Compound;0.08;0.78;0.14;0.1531
1;"Em feito histórico, em entrevista para ,  foi o único pré candidato de grande partido da história a se posicionar tão firmemente: 

- Que vai liberar a maconha. 
- Sobre ser a favor do aborto.
- Ser contra a maioridade penal.
- Ser favor do casamento gay. ";In a historical feat, in an interview for, he was the only pretest great party candidate in history to position himself so firmly: - That will release marijuana. - About being in favor of abortion. - To be against the criminal majority. - To be gay wedding favor.;Neg,Neu,Pos,Compound;0.063;0.709;0.228;0.8316
0;Henrique Meirelles é até hoje um dos nomes mais respeitados que o capitalismo Brasileiro produziu. Foi a única pessoa não-americana presidente de um banco dentro dos Estados Unidos, bem como administrou inúmeros fundos de investimentos e fez parte do conselho de várias empresas. ;Henrique Meirelles is to this day one of the most respected names that Brazilian capitalism has produced. He was the only non-American chairman of a bank within the United States, as well as managed numerous investment funds and served on the board of several companies.;Neg,Neu,Pos,Compound;0.0;0.832;0.168;0.807
1;"PORQUE O CANDIDATO DO PMDB, O HENRIQUE , É DE LONGE A MELHOR OPÇÃO PARA PRESIDÊNCIA DA REPÚBLICA?

(Thread constando única e exclusivamente minhas opiniões pessoais) ";WHY IS THE PMDB CANDIDATE, THE HENRIQUE, FAR FROM THE BEST OPTION FOR THE PRESIDENCY OF THE REPUBLIC? (Thread consisting solely and exclusively of my personal opinions);Neg,Neu,Pos,Compound;0.0;0.841;0.159;0.7125
0; Para quem falava em cortar despesas, parece que agora descobriu que aparelhar o STF é sinônimo de poder total! O melhor mesmo é, #ChamaOMeirelles Sem surpresas, sei o que esperar!;For those who talked about cutting expenses, it seems that now it has been discovered that equipping the FTS is synonymous with total power! The very best is, #ChamaOMeirelles No surprises, I know what to expect!;Neg,Neu,Pos,Compound;0.089;0.744;0.167;0.6459
1;Henrique Meirelles tá nas últimas;Henrique Meirelles is on the last;Neg,Neu,Pos,Compound;0.0;1.0;0.0;0.0
0;"   Eu até gostaria de votar nele, mas se até agora não conseguiu evoluir duvido que consiga.
Infelizmente a disputa eleitoral não é pra todos, normalmente os mais competentes em outras áreas falham na política.
ACORDA MEIRELLES!!!!";I would even like to vote for him, but if he has not been able to evolve so far, I doubt he can. Unfortunately the electoral contest is not for everyone, normally the most competent in other areas fail in politics. AGREES MEIRELLES !!!!;Neg,Neu,Pos,Compound;0.222;0.63;0.148;-0.7389
1; Qual é o partido do senhor?;What is your party?;Neg,Neu,Pos,Compound;0.0;0.526;0.474;0.4019
0;   E vc é micróbio da poça suja que eu pisei sem querer hj mais cedo. Quem votar aqui, tá votando no golpe e a favor do #ForaTemer;"And you&#39;re a microbe from the dirty puddle that I accidentally stepped on earlier. Whoever votes here, is voting in the coup and in favor of #ForaTemer";Neg,Neu,Pos,Compound;0.177;0.733;0.09;-0.3818
0; Engraçado q em lugar algum desse perfil se mostra de qual partido está filiado Henrique Meirelles. Qual partido é o ter Sr ministro da Economia do Governo #ForaTemer?;Funny that nowhere in this profile shows which party Henrique Meirelles is affiliated. Which party is the Minister of Economy of Government #ForaTemer?;Neg,Neu,Pos,Compound;0.0;0.707;0.293;0.8074
1;   Tamo junto;Tamo together;Neg,Neu,Pos,Compound;0.0;1.0;0.0;0.0
1;  Amanhã pode ser que não, quem sabe ela muda para melhor e #ChamaOMeirelles;"Tomorrow maybe not, maybe she&#39;ll change for the better and #ChamaOMeirelles";Neg,Neu,Pos,Compound;0.0;0.775;0.225;0.4404
1;   👏👏👏👏👏;(I.e.;Neg,Neu,Pos,Compound;0.0;1.0;0.0;0.0
1; Ah🙁 tudo bem eu vou votar no  😁😁😁😁😁;"Okay, I&#39;m going to vote for you.";Neg,Neu,Pos,Compound;0.0;0.759;0.241;0.2263
1;"  
";;Neg,Neu,Pos,Compound;0.0;0.0;0.0;0.0
0;"IBOPE PRESIDENCIAL EM SP (com Lula): 
Lula (PT): 24% 
Bolsonaro (PSL): 17%
Alckmin (13%)
Marina Silva (Rede): 8%
Ciro Gomes (PDT): 4%
Alvaro Dias (Podemos) e Henrique Meirelles (MDB): 2%";IBOPE PRESIDENTIAL IN SP (with Lula): Lula (PT): 24% Bolsonaro (PSL): 17% Alckmin (13%) Marina Silva (Network): 8% Ciro Gomes (PDT): 4% Alvaro Dias Henrique Meirelles (MDB): 2%;Neg,Neu,Pos,Compound;0.0;1.0;0.0;0.0
0;"IBOPE PRESIDENCIAL EM SP (Cenário sem Lula): 
Alvaro dias (Podemos) ( ): entre 2% e 3% 
Henrique Meirelles (MDB) () : 2% 
Fernando Collor de Mello (PTB) () : entre 1% e 2%
João Amoêdo (Novo) () : entre 1% e 2%";(2) and 3% Henrique Meirelles (MDB) (): 2% Fernando Collor de Mello (PTB) (): between 1% and 2% João Amoêdo (New) (): between 1% and 2%;Neg,Neu,Pos,Compound;0.0;1.0;0.0;0.0
1;#ChamaOMeirelles ;#ChamaOMeirelles;Neg,Neu,Pos,Compound;0.0;1.0;0.0;0.0
1; Cara, eu estou te fazendo uma pergunta simples: o que faz de Henrique Meirelles um socialista? Não consegue elencar motivos para sua afirmação?;"Dude, I&#39;m asking you a simple question: what makes Henrique Meirelles a socialist? Can you not list reasons for your claim?";Neg,Neu,Pos,Compound;0.0;1.0;0.0;0.0
0;           Boa sorte! Força pro estômago! Rsrs;Good luck! Strength to the stomach! Lol;Neg,Neu,Pos,Compound;0.0;0.194;0.806;0.9097
1; Me explique o porquê de Henrique Meirelles ser socialista. Vamos lá.;Explain to me why Henrique Meirelles is a socialist. Come on.;Neg,Neu,Pos,Compound;0.0;1.0;0.0;0.0
1; Henrique Meirelles, o liberal, é socialista?;Henrique Meirelles, the liberal, is a socialist?;Neg,Neu,Pos,Compound;0.0;1.0;0.0;0.0
