1;Me surpreende que a galera dita liberal dê mais atenção ao Roda Viva da Manuela D'avila do que ao do Henrique Meirelles.;"It surprises me that the galley called liberal give more attention to the Live Wheel of Manuela D&#39;avila than to Henrique Meirelles.";Neg,Neu,Pos,Compound;0.0;0.917;0.083;0.2263
0; Vai trabalhar para ganhar dinheiro limpo e suado... tinha até vergonha de postar algo. N é digno de respeito;"He&#39;s going to work to make money, clean and sweaty ... he was even embarrassed to post something. N is worthy of respect";Neg,Neu,Pos,Compound;0.086;0.616;0.298;0.7351
0;" :
Um monte de venezuelano vindo pro Brasil e a Manuela diz que os pré-candidatos não tem que se preocupar com a crise na Venezuela. Será que a Manu é do Levante, tá com Maduro? Sim ou com certeza? #RodaViva

 
 
 ";: A lot of Venezuelan coming to Brazil and Manuela says that pre-candidates do not have to worry about the crisis in Venezuela. Is Manu from Levante, is he with Maduro? Yes or for sure? #RodaViva;Neg,Neu,Pos,Compound;0.098;0.717;0.185;0.3952
1; Mas que foi #Golpe , foi.;But that was #Golpe, it was.;Neg,Neu,Pos,Compound;0.0;1.0;0.0;0.0
1; #meirelles2018;# meirelles2018;Neg,Neu,Pos,Compound;0.0;1.0;0.0;0.0
1; Nem eu! #ChamaOMeirelles;Me neither! #ChamaOMeirelles;Neg,Neu,Pos,Compound;0.0;1.0;0.0;0.0
0;Interessante... Embora o  não acredite na liberdade individual para autodefesa, acredita na liberdade individual para liberação de drogas. Economicismo travestido de liberdade.;Interesting ... Although he does not believe in individual freedom for self-defense, he believes in individual freedom for drug release. Economicism transvestite of freedom.;Neg,Neu,Pos,Compound;0.0;0.567;0.433;0.946
1;Ausência em ato afasta Henrique Meirelles do PCB;Absence in act removes Henrique Meirelles from PCB;Neg,Neu,Pos,Compound;0.0;1.0;0.0;0.0
0;   adotem essa medida urgente pra fazer o dólar cair 🤣 👇👇👇👇 ;adopt this urgent measure to make the dollar fall 🤣 👇👇👇👇;Neg,Neu,Pos,Compound;0.0;0.696;0.304;0.3612
1;Diz a pesquisa que a esquerda (o candidato de Lula ou Ciro Gomes) teria 40% de chances de ganhar a eleição. O centro (Marina Silva, Álvaro Dias, Geraldo Alckmin ou Henrique Meirelles) 25% e a direita (Jair Bolsonaro) 25%.;"The research says that the left (Lula&#39;s candidate or Ciro Gomes) would have a 40% chance of winning the election. The center (Marina Silva, Álvaro Dias, Geraldo Alckmin or Henrique Meirelles) 25% and the right (Jair Bolsonaro) 25%.";Neg,Neu,Pos,Compound;0.0;0.866;0.134;0.6597
0;O Atlas Político sobre a campanha presidencial, encomendado por gente importante do mercado financeiro, dá 40% de chance de vitória da esquerda (o candidato de Lula ou Ciro), 35% para o centro (Marina, Álvaro Dias, Alckmin ou Henrique Meirelles) e 25% para a direita ( Bolsonaro).;The Political Atlas on the presidential campaign, commissioned by important people in the financial market, gives a 40% chance of victory for the left (the candidate of Lula or Ciro), 35% for the center (Marina, Álvaro Dias, Alckmin or Henrique Meirelles) and 25% to the right (Bolsonaro).;Neg,Neu,Pos,Compound;0.0;0.921;0.079;0.4215
1;;;Neg,Neu,Pos,Compound;0.0;0.0;0.0;0.0
1;  Also wenn ein Finanzminister nicht an Geld kommt - wer dann? 😂;Also wenn ein Finanzminister nicht an Geld kommt - wer dann? (I.e.;Neg,Neu,Pos,Compound;0.0;1.0;0.0;0.0
1;"Retweeted Carlos Bolsonaro ():

Henrique Meirelles do PMDB lucrou mais de R$ 217 milhões com consultoria para grandes empresas só em 2016. Essa tal consultoria é a maior máquina de “dúvidas” sobre... ";"Retweeted Carlos Bolsonaro (): Henrique Meirelles from PMDB profited more than R $ 217 million with consulting for large companies only in 2016. This consultancy is the largest machine of &quot;doubts&quot; about ...";Neg,Neu,Pos,Compound;0.0;0.929;0.071;0.3182
1; ACABEI DE ME DECIDIR, VOU VOTAR EM VOCE, OS   ACABARAM DE ME CONVENCER.;I HAVE ACCEPTED DECIDING, I VOTED ON YOU, THEY HAVE FINISHED ME TO CONVINCE.;Neg,Neu,Pos,Compound;0.0;0.709;0.291;0.4767
1;"E o Janot??
Pq ficou de fora??

Vao blinda-lo que nem fizeram com o Henrique Meirelles, que era o Presidente do Conselho de Administracao da JBS e nao ""sabia de nada""??

Joesley Batista e ex-procurador Marcelo Miller são denunciados por corrupção ??

 ";"What about Janot ?? Why did you leave out? What did they do with Henrique Meirelles, who was the Chairman of the Board of Directors of JBS and did not &quot;know anything&quot; ?? Joesley Batista and former prosecutor Marcelo Miller are charged with corruption ??";Neg,Neu,Pos,Compound;0.084;0.916;0.0;-0.4515
0;        E fake não existe o estado da Palestina, essa medida provisória não existe;And fake does not exist the state of Palestine, this provisional measure does not exist;Neg,Neu,Pos,Compound;0.181;0.819;0.0;-0.4767
1;#Brasilien Finanzminister  will 70 Mio. Reais Privatvermögen in Präsidentschaftskandidatur stecken. Frage mich: Wie kommt ein jahrelanger Minister an ein solches Vermögen. Es wird ja auch nicht alles sein. Ihm wird auch Verstrickung bei #Panamapapers nachgesagt. ;#Brasilien Finanzminister will 70 Mio. Reais Privatvermögen in Präsidentschaftskandidatur stecken. Frage mich: Wie kommt ein jahrelanger Minister an ein solches Vermögen. It is wird ja auch nicht alles sein. Ihm wird auch Verstrickung bei #Panamapapers nachgesagt.;Neg,Neu,Pos,Compound;0.0;1.0;0.0;0.0
1;Bad news for  ? Former finance minister says he's willing to spend up to 70 million reais of his own cash to run for the presidency for the MDB. He's currently on about 1 percent of vote intentions ;"Bad news for? Former finance minister says he&#39;s willing to spend up to 70 million reais of his own cash to run for the presidency for the MDB. He&#39;s currently on about 1 percent of vote intentions";Neg,Neu,Pos,Compound;0.091;0.909;0.0;-0.5423
1;Deus nos livre desse economista do satanás no poder. Chamado Henrique Meirelles;May God save us from this Satanist economist in power. Called Henrique Meirelles;Neg,Neu,Pos,Compound;0.0;0.675;0.325;0.6486
1;  Er war CEO einer US- Grossbank. Sollte man wissen als “journalist”...;"Er war CEO einer US- Grossbank. Sollte man wissen als &quot;journalist&quot; ...";Neg,Neu,Pos,Compound;0.262;0.738;0.0;-0.5994
0;  O senhor quer um teto de gastos para sobrar mais dinheiro para dar aos banqueiros ?;Do you want a spending ceiling to spare more money to give to the bankers?;Neg,Neu,Pos,Compound;0.0;0.909;0.091;0.0772
1;Henrique Meirelles conta com uma equipe experiente formada por mais de 10 pessoas e já rodada em campanhas anteriores. ;Henrique Meirelles has an experienced team of more than 10 people and has been running in previous campaigns.;Neg,Neu,Pos,Compound;0.0;1.0;0.0;0.0
1;O “marqueteiro em ascensão” de Henrique Meirelles ;"Henrique Meirelles&#39;s &quot;marketer on the rise&quot;";Neg,Neu,Pos,Compound;0.0;1.0;0.0;0.0
1; Dá para ser político sem roubar? Te convido para uma reflexão.;Can you be a politician without stealing? I invite you to a reflection.;Neg,Neu,Pos,Compound;0.116;0.643;0.241;0.3724
0; Querendo se vender como candidato de centro ao tempo que provoca a bárbarie na sociedade brasileira.;Wanting to sell himself as a center candidate at the time that provokes barbarism in Brazilian society.;Neg,Neu,Pos,Compound;0.133;0.867;0.0;-0.3182
1; Os assessores...kkkk ainda vou ver um Meirelles elogiando o Meirelles igual o alckmin;The advisors ... kkkk I will still see a Meirelles praising the Meirelles equal the alckmin;Neg,Neu,Pos,Compound;0.0;0.788;0.212;0.5423
1; Muito bom!;Very good!;Neg,Neu,Pos,Compound;0.0;0.223;0.777;0.54
0;"Narrativa feminista impulsiona Manuela nas redes sociais. 
                 ";Feminist narrative drives Manuela on social networks.;Neg,Neu,Pos,Compound;0.0;1.0;0.0;0.0
0;E Sérgio Prosdócimo foi embora sem ouvir as previsões de Henrique Meirelles ;And Sérgio Prosdócimo left without hearing the predictions of Henrique Meirelles;Neg,Neu,Pos,Compound;0.0;1.0;0.0;0.0
1; Vendedores de terrenos no céu. Candidato ser senhor adotar uma combate radical desses vendedores do paraíso as pessoas poderia cair na real que se e tão fácil o senhor como ministro teria já feito como profissional que é de 1° linha !;Sellers of land in the sky. Candidate to be Lord take a radical fight these sellers of paradise people could fall into the real that if and as easy the lord as minister would have already done as a professional who is 1st line!;Neg,Neu,Pos,Compound;0.053;0.796;0.151;0.6996
1;Apesar de voce,  apoiar a liberacao da maconha, estou retuitando seu post, ta ? Seja um bom menino e que isso nao se repita ! ;"Even though you support the marijuana release, I&#39;m retyping your post, huh? Be a good boy and do not repeat it!";Neg,Neu,Pos,Compound;0.0;0.753;0.247;0.7088
0; A melhor opção considerando isso é Henrique ;The best option considering this is Henrique;Neg,Neu,Pos,Compound;0.0;0.588;0.412;0.6369
0;   - e quem vai pagar? Cartão corporativo, manda a nota para ao TCu?;- And who will pay? Corporate card, send the note to TCu?;Neg,Neu,Pos,Compound;0.15;0.85;0.0;-0.1926
1; Cara, vc era o nome do Centrão!!! Tinha que ter vindo com o PSDB... não tenho dúvidas que é o melhor candidato;Dude, you were the name of the Centrão !!! I had to come with the PSDB ... I have no doubt that he is the best candidate;Neg,Neu,Pos,Compound;0.175;0.692;0.132;0.3348
1;Henrique Meirelles desembarca em João Pessoa e CG nesta semana - Nordeste 1 ;Henrique Meirelles lands in João Pessoa and CG this week - Northeast 1;Neg,Neu,Pos,Compound;0.0;1.0;0.0;0.0
1;"Retweeted O Antagonista ():

Henrique Meirelles, com apenas 1% de intenções de voto, contratou uma fonoaudióloga para tentar melhorar sua fala. ";Retweeted The Antagonist (): Henrique Meirelles, with only 1% of voting intentions, hired a speech therapist to try to improve his speech.;Neg,Neu,Pos,Compound;0.117;0.766;0.117;0.0
0;Henrique Meirelles desembarca em João Pessoa e CG nesta semana ;Henrique Meirelles lands in João Pessoa and CG this week;Neg,Neu,Pos,Compound;0.0;1.0;0.0;0.0
1;"Agora vai... 😀

: Henrique Meirelles, com apenas 1% de intenções de voto, contratou uma fonoaudióloga para tentar melhorar sua fala. ";"Now she&#39;s going to ... 😀: Henrique Meirelles, with only 1% of voting intentions, hired a speech therapist to try to improve his speech.";Neg,Neu,Pos,Compound;0.0;0.884;0.116;0.4404
0;  Tá.. mas o que ele fez enquanto Ministro da Fazenda e Presidente do BNDES pra controlar os gastos....nada, cúmplice da atual situação;Okay ... but what he did as Minister of Finance and President of the BNDES to control the expenses .... nothing, complicit in the current situation;Neg,Neu,Pos,Compound;0.0;0.945;0.055;0.1154
1;Em visita a Cuiabá, Henrique Meirelles diz que MT sofre com 'falta de gestão' ;"During a visit to Cuiabá, Henrique Meirelles says that MT suffers from &#39;lack of management&#39;";Neg,Neu,Pos,Compound;0.193;0.807;0.0;-0.4767
1;Henrique Meirelles na Paraíba ;Henrique Meirelles in Paraíba;Neg,Neu,Pos,Compound;0.0;1.0;0.0;0.0
1;  Copa?;Cup?;Neg,Neu,Pos,Compound;0.0;1.0;0.0;0.0
0;Henrique Meirelles desembarca em  João Pessoa e CG nesta semana -  ;Henrique Meirelles lands in João Pessoa and CG this week -;Neg,Neu,Pos,Compound;0.0;1.0;0.0;0.0
0;    Se até o Lula amealhou vinte sete milhões em palestras, imaginem o   que é mais escolarizado!;If even Lula has amassed twenty seven million in lectures, imagine what is more schooled!;Neg,Neu,Pos,Compound;0.0;1.0;0.0;0.0
1;Seu ex-patrão foi denunciado,  ;His ex-boss was denounced,;Neg,Neu,Pos,Compound;0.0;1.0;0.0;0.0
1; E o você e o seu partido são os extremos filhos da puta;And you and your party are the extreme motherfuckers.;Neg,Neu,Pos,Compound;0.0;0.748;0.252;0.4019
0;   Você acha que os Bolsonaros temem estes asquerosos ?;Do you think the Bolsonaros fear these disgusting ones?;Neg,Neu,Pos,Compound;0.485;0.515;0.0;-0.765
1; Olha, o senhor e os demais para mim são como os “zeros” a esquerda da matemática básica, nada acrescentam e nada acrescentaram quando puderam.  sugiro que  mude seu ângulo de visão, como uma força jovem estas “raposas” não acrescentam.;"Look, you and the others are like the &quot;zeros&quot; to the left of basic mathematics, they add nothing and add nothing when you can. I suggest you change your angle of vision, as a young force these &quot;foxes&quot; do not add.";Neg,Neu,Pos,Compound;0.0;0.892;0.108;0.5423
0;" Ola Meirelles. Você esta certo e minha avaliação é técnica de engenheiro de operações civil, Especialista engenharia produção/ Engenharia economica, Perito de engenharia e Perito Criminal.

Estes candidatos que brincam com dinheiro público, enganam o povo e destroem o Estado";Hello Meirelles. You are right and my assessment is civil operations engineer, specialist engineering production / economics engineer, engineering expert and criminal expert. These candidates who play with public money deceive the people and destroy the state;Neg,Neu,Pos,Compound;0.218;0.727;0.055;-0.802
1;"Retweeted Carlos Bolsonaro ():

Henrique Meirelles do PMDB lucrou mais de R$ 217 milhões com consultoria para grandes empresas só em 2016. Essa tal consultoria é a maior máquina de “dúvidas” sobre... ";"Retweeted Carlos Bolsonaro (): Henrique Meirelles from PMDB profited more than R $ 217 million with consulting for large companies only in 2016. This consultancy is the largest machine of &quot;doubts&quot; about ...";Neg,Neu,Pos,Compound;0.0;0.929;0.071;0.3182
0;"Uh coitado
O “marqueteiro em ascensão” de Henrique Meirelles ";"Uh poor The &quot;marketer on the rise&quot; by Henrique Meirelles";Neg,Neu,Pos,Compound;0.256;0.744;0.0;-0.4767
0;Henrique Meirelles, candidato à presidência em 2018 pelo MDB, disse que MT precisa ‘aprender a se virar sozinho’. O presidenciável também questionou a qualidade das administrações passadas ;"Henrique Meirelles, MDB&#39;s presidential candidate in 2018, said that MT needs to &#39;learn how to go it alone&#39;. The Chair also questioned the quality of past administrations";Neg,Neu,Pos,Compound;0.051;0.949;0.0;-0.1027
0; henrique meirelles não a dianta quere desmerece as proposta dos pre candidatos pq a final vc nao vai passa desse ano no seu cargo..;henrique meirelles not the dianta wants to demean the proposals of the pre candidates because the end you will not spend this year in your position ..;Neg,Neu,Pos,Compound;0.0;1.0;0.0;0.0
0;Efeitos nocivos da maconha que o  quer tanto liberar. A sorte é que Henrique Meirelles, o ex-empregado do criminoso confesso Joesley Batista e indicado de Michel Temer, não tem nenhuma chance de ganhar. ;Harmful effects of marijuana that you want so much to release. Fortunately, Henrique Meirelles, the former employee of the criminal confessed Joesley Batista and appointed by Michel Temer, has no chance to win.;Neg,Neu,Pos,Compound;0.138;0.688;0.174;0.128
1; A segregação sobre interessa aos ideólogos.;Segregation over interests ideologists.;Neg,Neu,Pos,Compound;0.0;0.6;0.4;0.25
1; Continua e persegue este objetivo. Varias serão as adversidades.;Continue and pursue this goal. There will be many adversities.;Neg,Neu,Pos,Compound;0.217;0.783;0.0;-0.3612
1;                 João Doria.;João Doria.;Neg,Neu,Pos,Compound;0.0;1.0;0.0;0.0
1; Como será o diálogo entre o  e o  ? Haverá novas diretrizes à inserção internacional do país?;"How will the dialogue be between him and him? Will there be new guidelines for the country&#39;s international insertion?";Neg,Neu,Pos,Compound;0.0;1.0;0.0;0.0
1;" O senhor é tão sujo quanto o senhor Temer! 

#ForaTemer #GlobonaCopa #SouSporTVnaCopa #forawilsonpintojr";You are as dirty as Mr. Temer! #ForaTemer #GlobonaCopa #SouSporTVnaCopa #forawilsonpintojr;Neg,Neu,Pos,Compound;0.242;0.758;0.0;-0.4926
1;Impressionante como não fazem questão de uma agenda positiva, que falta que faz o Meirelles.   ;Impressive as they do not make a point of a positive agenda, that lack that does the Meirelles.;Neg,Neu,Pos,Compound;0.104;0.586;0.311;0.6808
1;"   ""Meirelles enviou à reportagem do Poder360 cópia de sua declaração de Imposto de Renda, provando que a offshore dele está devidamente registrada...."" - Veja mais em ";"&quot;Meirelles sent a copy of his income tax return to the report of Poder360, proving that his offshore is duly registered ....&quot; - See more in";Neg,Neu,Pos,Compound;0.0;1.0;0.0;0.0
0; Tu é muito cara de pai, por mais tecnicamente preparado q seja na área econômica. Postar uma equivalência entre Ciro e Bolsonaro, é desespero, só pode.;You are very expensive of father, however technically prepared it is in the economic area. To post an equivalence between Cyrus and Bolsonaro, it is despair, it can only.;Neg,Neu,Pos,Compound;0.074;0.865;0.061;-0.1027
0; Se vc sabia disso, porque não fez? Pq não diminuiu os comissionados e reduziu as despesas de custeio?;If you knew this, why did not you? Why not reduce commissioners and reduce costing expenses?;Neg,Neu,Pos,Compound;0.0;1.0;0.0;0.0
0; Nos teus 2 anos de ministro da fazenda a divida só aumentou.;In your 2 years of minister of the farm the debt only increased.;Neg,Neu,Pos,Compound;0.171;0.685;0.144;-0.1027
0;  soberano onde? ele se associa com as piores pessoas que existem no país;sovereign where? he associates with the worst people in the country;Neg,Neu,Pos,Compound;0.291;0.709;0.0;-0.6249
1;" Paulo Guedes &gt;&gt;&gt;&gt;&gt;&gt;&gt;&gt;&gt;&gt;&gt;&gt;&gt;&gt;&gt;&gt; Henrique Meirelles";"Paulo Guedes &gt;&gt;&gt;&gt;&gt;&gt;&gt;&gt;&gt;&gt;&gt;&gt;&gt;&gt;&gt;&gt; Henrique Meirelles";Neg,Neu,Pos,Compound;0.0;1.0;0.0;0.0
1; ;;Neg,Neu,Pos,Compound;0.0;0.0;0.0;0.0
1;" Raros pré-candidatos registram um currículo tão invejável qnto o d Mei. Graças a sua brilhante atuação na Fazenda, BC...está destinado a  resolver o problema fiscal🎵🎤E isso dá um tique,tique nos tontos, tique,tique nos tontos...✌ opções: continuar no atraso ou
#ChamaOMeirelles";Rare pre-candidates register such an enviable curriculum qnto od Mei. Thanks to her brilliant performance on the Farm, BC ... is destined to solve the fiscal problem. And this gives a tic, tic on the fools, tic, tic on the fools ... ✌ options: continue in arrears or #ChamaOMeirelles;Neg,Neu,Pos,Compound;0.155;0.7;0.145;-0.1531
1; Sr. Meirelles, será que você chegará ao 1%? Ou continuará com 0,5%?;Mr. Meirelles, will you reach 1%? Or will it continue with 0.5%?;Neg,Neu,Pos,Compound;0.0;0.883;0.117;0.1179
0; Mas com você também não vai dar certo, afinal, você como ministro da Fazenda, atual para perdoar dívidas de vários grupos bilionários nacionais.;But with you, too, you will not succeed, after all, as finance minister, current to forgive the debts of several national billionaire groups.;Neg,Neu,Pos,Compound;0.102;0.816;0.082;-0.1351
1; Henrique Meirelles  lucrou mais de R$ 217 milhões com consultoria para grandes empresas só em 2016. Essa tal consultoria é a maior máquina de “dúvidas” sobre gastos verdadeiros em serviços “justificados” da política brasileira.;"Henrique Meirelles earned more than R $ 217 million with consultancy for large companies only in 2016. This consultancy is the largest machine of &quot;doubts&quot; about true expenditures on &quot;justified&quot; services of Brazilian policy.";Neg,Neu,Pos,Compound;0.0;0.917;0.083;0.4215
1;Não existe solução fácil para problema difícil. #ChamaOMeirelles que ele resolve. ;There is no easy solution to a difficult problem. #ChamaOMeirelles what he solves.;Neg,Neu,Pos,Compound;0.357;0.29;0.353;-0.0258
0;  Milagre não existe mesmo.Voce está há anos cuidando da economia e deu nessa merda em que estamos. O Bolsonaro só sabe administrar o bolso dele,mas o  pode sim ser uma solução;"Miracle does not exist even. You&#39;ve been taking care of the economy for years and you&#39;re in this shit. Bolsonaro only knows how to manage his pocket, but it can be a solution";Neg,Neu,Pos,Compound;0.069;0.735;0.196;0.5893
1;henrique meirelles na equipe médica do uruguai;henrique meirelles in the uruguayan medical team;Neg,Neu,Pos,Compound;0.0;1.0;0.0;0.0
1;    💤;(I.e.;Neg,Neu,Pos,Compound;0.0;1.0;0.0;0.0
1;     ;;Neg,Neu,Pos,Compound;0.0;0.0;0.0;0.0
1;   Outro contexto. Acho que as unicas reformas que poderiam ter sido antecipadas eram a do teto e a trabalhista. Claro que se tivesse feito tudo antes seria melhor ou ao menos ter comecado a discussao..;Another context. I think the only reforms that could have been anticipated were the ceiling and the labor. Of course if you had done everything before, it would have been better or at least you started the discussion.;Neg,Neu,Pos,Compound;0.0;0.925;0.075;0.4404
0; Soluções mágicas nunca deram certo. Precisam de uma pessoa técnica que saiba montar uma equipe boa e competente.;Magic solutions never worked out. They need a technical person who can build a good and competent team.;Neg,Neu,Pos,Compound;0.0;0.653;0.347;0.7096
1;  Já começou o medinho do ? Ele tem como comprovar, e o patrimônio do Bolsonaro, tem como comprovar? Responde por favor, queremos ver!;Already started the medinho do? He has how to prove, and the assets of Bolsonaro, can prove it? Answer please, we want to see!;Neg,Neu,Pos,Compound;0.0;0.779;0.221;0.6062
0; O dinheiro da saúde está no bolso dos corruptos, dos políticos e funcionários públicos que exploram o contribuinte.;Health money is in the pocket of the corrupt, the politicians and civil servants who exploit the taxpayer.;Neg,Neu,Pos,Compound;0.076;0.924;0.0;-0.1027
1;  #ChamaOMeirelles  #Correndo;#ChamaOMeirelles #Correndo;Neg,Neu,Pos,Compound;0.0;1.0;0.0;0.0
1;O “marqueteiro em ascensão” de Henrique Meirelles ;"Henrique Meirelles&#39;s &quot;marketer on the rise&quot;";Neg,Neu,Pos,Compound;0.0;1.0;0.0;0.0
1;  ;;Neg,Neu,Pos,Compound;0.0;0.0;0.0;0.0
1;O “marqueteiro em ascensão” de Henrique Meirelles ;"Henrique Meirelles&#39;s &quot;marketer on the rise&quot;";Neg,Neu,Pos,Compound;0.0;1.0;0.0;0.0
0;  Seu  , quando o senhor vai sair do 0% ❔;When will you leave the 0%?;Neg,Neu,Pos,Compound;0.194;0.806;0.0;-0.0516
0;"  Claro que não! Vocês são prova viva disso! Se existisse não continuaríamos nesse mar de lama econômico! A ""solução milagrosa"", Temer, o que resolveu???";"Of course not! You are living proof of this! If it existed we would not continue in this sea of ​​economic mud! The &quot;miracle solution&quot;, Temer, what solved ???";Neg,Neu,Pos,Compound;0.0;0.888;0.112;0.5448
1;  Exatamente... observando o comportamento deles, fica fácil de perceber isso.;"Exactly ... observing their behavior, it&#39;s easy to see that.";Neg,Neu,Pos,Compound;0.0;0.756;0.244;0.4404
1; Teto de gastos é uma burrice institucional. Teto de despesa = piso de receita. Continha simples, não? Quem aplicar essa noçãozinha fará básica da disciplina de economia na nossa economia, se dará bem! Não é milagre algum!!!;"Expense ceiling is an institutional stupidity. Expense ceiling = revenue floor. It was simple, was not it? Whoever applies this notion will make the basic discipline of economics in our economy, it will do well! It&#39;s not some miracle !!!";Neg,Neu,Pos,Compound;0.158;0.796;0.046;-0.7219
0; Esses dois não passam de uns aproveitadores da crise moral e ética na política. Fazem parte do mesmo balaio de gatos.;These two are just some profiteers of moral and ethical crisis in politics. They are part of the same cat litter.;Neg,Neu,Pos,Compound;0.152;0.669;0.178;-0.0772
1; N´so ainda vamos ter um país promissor, basta escolhermos gente que proponha isso no governo.;We will still have a promising country, we only have to choose people who propose it in government.;Neg,Neu,Pos,Compound;0.0;0.856;0.144;0.4019
0; Doutro Meirelles, o senhor é muito mais soberano por conta da sua sabedoria e experiência, siga no seu caminho que tudo vai dar certo!;Doutro Meirelles, you are much more sovereign because of your wisdom and experience, follow your path that everything will work!;Neg,Neu,Pos,Compound;0.0;0.837;0.163;0.5707
1; Esses dois, se colocar na mesma sala, eles acabam se beijando.;These two, if put in the same room, they end up kissing.;Neg,Neu,Pos,Compound;0.0;0.748;0.252;0.5719
0; Siga que vai dar certo!;Follow that will work!;Neg,Neu,Pos,Compound;0.0;1.0;0.0;0.0
0;  Lembrando que ele nao teve nem um mandato inteiro pra fazer as reformas, tao pouco um governo forte pra acelerar outras reformas!;Remembering that he did not have an entire mandate to carry out the reforms, so little was a strong government to accelerate other reforms!;Neg,Neu,Pos,Compound;0.0;0.86;0.14;0.554
1;" Tambem acho ministro, mas como diz o aforismo de Heraclito de Efeso, ""O asno prefere palha ao ouro"", fazer o que ?";"I also find the minister, but as the aphorism of Heraclitus of Ephesus says, &quot;The donkey prefers straw to gold,&quot; to do what?";Neg,Neu,Pos,Compound;0.0;1.0;0.0;0.0
1; Solução milagrosa não existe!  #Meirelles2018;Miraculous solution does not exist! # Meirelles2018;Neg,Neu,Pos,Compound;0.0;0.659;0.341;0.3802
1; Congelando saúde e educação?;Freezing health and education?;Neg,Neu,Pos,Compound;0.318;0.682;0.0;-0.1027
1; Ciro extrema esquerda? vc ta doido?;Cyrus extreme left? You are crazy?;Neg,Neu,Pos,Compound;0.356;0.644;0.0;-0.4137
1;O “marqueteiro em ascensão” de Henrique Meirelles ;"Henrique Meirelles&#39;s &quot;marketer on the rise&quot;";Neg,Neu,Pos,Compound;0.0;1.0;0.0;0.0
1;Henrique Meirelles se reúne com lideranças em Cuiabá ;Henrique Meirelles meets with leaders in Cuiabá;Neg,Neu,Pos,Compound;0.0;1.0;0.0;0.0
